{
  "generated_at": "2026-04-22T01:53:27.867714+00:00",
  "source_document": "/Users/jiayinghe/Desktop/读书日.docx",
  "books": [
    {
      "id": "book-001",
      "title": "科技共和国",
      "recommender": "凌空天行 王毓栋",
      "recommendation": "我想推荐这本《科技共和国》,palantir的ceo 坎普著作。这本书让我看到,当下正处在以人工智能为代表的前沿科技快速兴起、世界长期动荡成为常态的处境,科技与国防深度绑定已是大国竞争的核心现实;它也改变了我对技术与国家关系的认知,尤其看到以Palantir坎普为代表的美国科技从业者,正主动将技术尤其是人工智能与国家军事战略结合、呼吁回归国家本位,这让我更加坚信科技工作者从来都有国度,并非无国界中立。同时它也让我形成判断:未来对抗只会加剧,破除霸权只能靠自身强大,我们不能再盲目推崇过去印象中美国的那套理念,既要看到他们自身认知的转变,更要思考我们该如何调整、如何自强,以应对未来长期的竞争与变局。\n一个让我很触动的句子:“美国当前面临的最核心挑战之一,是如何确保美国国防部能够从一个旨在打赢动能战争的机构,转型为能够设计、建造并部署人工智能武器系统的组织——这里所说的人工智能武器,主要指的是那些将主导未来战场的无人机群与机器人。”",
      "quote": "美国当前面临的最核心挑战之一,是如何确保美国国防部能够从一个旨在打赢动能战争的机构,转型为能够设计、建造并部署人工智能武器系统的组织——这里所说的人工智能武器,主要指的是那些将主导未来战场的无人机群与机器人。",
      "isbn": "9787521779608",
      "isbn10": null,
      "isbn13": "9787521779608",
      "cover_url": "/covers/book-001.jpg",
      "cover_thumbnail_url": "/covers/book-001-thumb.jpg",
      "enrichment": {
        "source": "douban",
        "matched_title": "科技共和国",
        "confidence": 0.99
      },
      "author": "亚历山大·卡普 / 尼古拉斯·扎米斯卡"
    },
    {
      "id": "book-002",
      "title": "有限与无限的游戏——一个哲学家眼中的竞技世界",
      "recommender": "上海旷通科技/严慧江",
      "recommendation": "这是一本写于近四十年前的哲学书籍,作者将对世界运行规则的哲学洞察寓于两种不同的游戏抽象的简单隐喻之中。两种对立的“游戏”是一种思考框架,能将我们的生活、工作,甚至当今日新月异发展的AI技术和创业也纳入这个框架,从而获得不一样的视角和启发。每当将与我们息息相关的东西代入其中,都会引发我们停下来审视和思考。这十年来AI变化太快,在深邃和冷静的哲学相伴而行之下,也许能看到些不同的东西。",
      "quote": "这十年来AI变化太快,在深邃和冷静的哲学相伴而行之下,也许能看到些不同的东西",
      "isbn": "9787121215698",
      "isbn10": null,
      "isbn13": "9787121215698",
      "cover_url": "/covers/book-002.jpg",
      "cover_thumbnail_url": "/covers/book-002-thumb.jpg",
      "enrichment": {
        "source": "douban",
        "matched_title": "有限与无限的游戏",
        "confidence": 0.98
      },
      "author": "詹姆斯·卡斯"
    },
    {
      "id": "book-003",
      "title": "从优秀到卓越",
      "recommender": "深圳屹艮科技创始人兼CEO 郑家新",
      "recommendation": "这本书让我理解了一个公司或一个组织优秀与卓越的差异,以及从优秀到卓越的实现路径。优秀的公司很多,但真正做到卓越、基业长青的公司并不多,如何实现从优秀到卓越的跨越,柯林斯告诉我们首先是CEO本人要成为第5级经理人,拥有谦逊的品质和超强的意志和决心。这本书也不仅让我看到第5级经理人的重要性,也让我理解到一个公司的核心竞争力不是技术壁垒,而是公司的人、组织和文化,所以需要先人后事。同时,刺猬理论让我认识到建立了卓越的人、组织和文化之后,还需要咬定并聚焦战略目标,而如何制定战略目标,则基于三环理论。一个公司或组织基于以上基础,进一步构建训练有素的文化和技术加速器,便能形成进化飞轮,最终实现从优秀到卓越的跨越。我觉得这本书永不过时,深刻阐述了从优秀到卓越的第一性原理,值得我们重读、多读。",
      "quote": "优秀是卓越的大敌。",
      "isbn": "9787508617138",
      "isbn10": null,
      "isbn13": "9787508617138",
      "cover_url": "/covers/book-003.jpg",
      "cover_thumbnail_url": "/covers/book-003-thumb.jpg",
      "enrichment": {
        "source": "douban",
        "matched_title": "从优秀到卓越",
        "confidence": 0.99
      },
      "author": "吉姆·柯林斯"
    },
    {
      "id": "book-004",
      "title": "预测之书:1000天后的世界",
      "recommender": "陈大凯 / 科凯(南通)生命科学有限公司创始人兼董事长",
      "recommendation": "我特别想推荐这本书。身处医疗器械这个非常特殊的赛道,我们既要遵循严苛的法规、关注临床的真实反馈,又要时刻保持对技术前沿的敏锐。这本书提供了一个独特的观察角度:不是简单地仰望遥远的技术愿景,也不是埋头苦干只解决眼下问题,而是站在今天,去思考“1000天后”的世界会是什么样。\n它非常契合我今天所面对的处境——AI已经从技术变量演变成重构所有行业的底层力量。在医疗器械领域,AI正在重塑从材料筛选、结构设计到手术规划、患者随访的全链条。\n看我们走过的路,从2018年成立开始研发首款产品,到2025年、2026年连续获批上市并实现三瓣膜全覆盖及“修复+置换”双轮驱动的产业布局,我们所做的每一步,其实都是在为“1000天后”的心血管疾病患者,提供一套更具前瞻性的系统解决方案。它时刻提醒我自己和团队,做研发不能只顾眼前,创业者必须让自己活在未来。",
      "quote": "“去做那种需要花15分钟才能向父母解释清楚的工作,这意味着它没有被完全定义,没有固定的职业路径,也没有标准化的竞争对手。此刻正在做这件事的你,本身就是它的定义者。”",
      "isbn": "9787513358217",
      "isbn10": null,
      "isbn13": "9787513358217",
      "cover_url": "/covers/book-004.jpg",
      "cover_thumbnail_url": "/covers/book-004-thumb.jpg",
      "enrichment": {
        "source": "douban",
        "matched_title": "预测之书",
        "confidence": 0.97
      },
      "author": "罗振宇（主编）"
    },
    {
      "id": "book-005",
      "title": "个人知识",
      "recommender": "思为科技创始人 彭双全",
      "recommendation": "波兰尼在六十年前提出”默会知识”这个概念:“我们所知道的,多于我们所能言说的。”\n知识从来不是被动接收的信息,而是人真正进入现实、在摩擦中承担代价后留下的痕迹。无法被完整言说,只能被经历。知识不是你”获得”的一个对象,而是你”进入”的一种状态。\n六十年后,AI把这件事逼到了明处——信息获取的成本趋近于零,但那个必须亲身去经历的过程,从来没有人可以代劳。​​​​​​​​​​​​​​​​",
      "quote": "我们所知道的,多于我们所能言说的。",
      "isbn": "9787208172746",
      "isbn10": null,
      "isbn13": "9787208172746",
      "cover_url": "/covers/book-005.jpg",
      "cover_thumbnail_url": "/covers/book-005-thumb.jpg",
      "enrichment": {
        "source": "douban",
        "matched_title": "个人知识",
        "confidence": 0.99
      },
      "author": "迈克尔·波兰尼"
    },
    {
      "id": "book-006",
      "title": "硅谷热",
      "recommender": "王庆",
      "recommendation": "去理解硅谷开始的发展和硅谷早期和日本人的竞争,非常适合去理解现在ai来临后,中国和硅谷的竞争,理解硅谷应对竞争者的策略和姿态。也更好的理解怎么和硅谷生态做融入和竞争。“We’re at war with Japan—not with guns and ammunition, but an economic war with technology, productivity and quality.Unless our government takes action, I don’t know how there will be a semiconductor industry here in the future.",
      "quote": "We’re at war with Japan—not with guns and ammunition, but an economic war with technology, productivity and quality.Unless our government takes action, I don’t know how there will be a semiconductor industry here in the future.",
      "isbn": "9787121332395",
      "isbn10": null,
      "isbn13": "9787121332395",
      "cover_url": "/covers/book-006.jpg",
      "cover_thumbnail_url": "/covers/book-006-thumb.jpg",
      "enrichment": {
        "source": "publisher",
        "matched_title": "硅谷热：高科技文化的成长",
        "confidence": 0.8
      },
      "author": "埃弗里特·M. 罗杰斯 / 朱迪丝·K. 拉森"
    },
    {
      "id": "book-007",
      "title": "何为人类: GPT书写的人类备忘录",
      "recommender": "张希,屹锂科技创始人",
      "recommendation": "这本书里由GPT-3模拟思辨路径生成兼具灵性与诗意的回答,让我对正从事的固态电池事业中科学、艺术、人文结合推进原始创新的可行性更为坚信。",
      "quote": "“透过机器之心探寻人类与AI共存的未来”",
      "isbn": "9787521754452",
      "isbn10": null,
      "isbn13": "9787521754452",
      "cover_url": "/covers/book-007.jpg",
      "cover_thumbnail_url": "/covers/book-007-thumb.jpg",
      "enrichment": {
        "source": "megbook",
        "matched_title": "何为人类",
        "confidence": 0.96
      },
      "author": "伊恩·S. 托马斯 / GPT-3"
    },
    {
      "id": "book-008",
      "title": "极简增长",
      "recommender": "李贤威/上海云生未来技术集团有限公司创始人",
      "recommendation": "一、这本书帮助理解了什么样的当下处境?\n这本书精准点破了存量经济、高度内卷时代的企业困局:我们正从“铺摊子、冲规模”的粗放增长,转向“拼效率、拼聚焦”的高质量生存。多数企业的增长焦虑,根源不是机会太少,而是机会太多、动作太杂、资源太散——陷入“复杂性陷阱”,什么都想做、什么都做不精,最终在同质化竞争中耗尽资源。\n它让我看清:当下不是“做多”的时代,而是“做少、做透”的时代;不是比拼广度,而是“一米宽、一百米深”的深度决战,这本书直接解释了为何全品类扩张易失效、垂直深耕才是破局关键。\n二、它如何影响了对商业、技术与行业的看法?重构了“增长=做减法”的底层认知:\n1. 商业本质回归:增长不是加法叠加,而是先做“除法”砍掉错配与浪费,再做“乘法”聚焦核心。一切决策以“四大灵魂追问”为金标准:核心客户是谁?核心需求是什么?核心产品是什么?核心销售系统是什么?无关业务坚决不做、无关人员坚决不招、无关预算坚决不花。\n2. 技术与资源观:AI、数字化不是越全越好,而是越贴核心需求越有价值。大企业拼“万米宽、十米深”的通用能力,中小企业必须走“钻井模式”——小切口、大市场,把垂直场景做深做透、端到端交付。\n3. 行业竞争观:真正的护城河不是规模、不是渠道,而是对核心需求的极致垄断。\n三、是否帮助形成对未来的判断?明确了三大未来判断:\n1. 极简是长期趋势:存量时代+AI变革,“简单、聚焦、高效”是企业生存的底层法则,复杂组织与分散业务将加速淘汰。\n2. 垂直胜出、通用溃败:未来赢家是细分王者——在“针尖大的领域”捅破天,而非大而全的平庸平台。\n3. 增长回归“第一性原理”:所有增长必须回到核心客户、核心需求、核心产品,任何脱离此三点的扩张都是泡沫。\n四、为什么今天值得重读?\n1、时代适配性:经济放缓、行业内卷、AI重构产业,极简增长不是短期战术,而是长期生存战略,越复杂越要回归简单。\n2、实践落地性:不是空泛理论,而是可执行、可复盘、可考核的决策框架,能直接用。\n认知反常识:在人人都谈“第二曲线、全域覆盖”时,这本书提醒“敢放弃、敢聚焦”才是最稀缺的领导力。",
      "quote": "“在追求增长的道路上,简约是一种力量,专注是一种智慧。”",
      "isbn": "9787572289705",
      "isbn10": null,
      "isbn13": "9787572289705",
      "cover_url": "/covers/book-008.jpg",
      "cover_thumbnail_url": "/covers/book-008-thumb.jpg",
      "enrichment": {
        "source": "douban",
        "matched_title": "极简增长",
        "confidence": 0.99
      },
      "author": "彭志强"
    },
    {
      "id": "book-009",
      "title": "石油风云",
      "recommender": "火山石投资 章苏阳",
      "recommendation": "93年看的这本书,写得好翻译得也好。近代的许多战争归根结底都是围绕抢夺石油资源展开的。一个特定的资源对国家安全至关重要,为此各国往往不惜一切代价保障自身发展利益。曾经这种资源是看得见的能源,而如今的资源既有看得见的又有看不见的,且后者日渐增长,例如核聚变、量子计算,超级AI等等。虽然资源的形式变了,但抢资源的本质从未改变。",
      "quote": "虽然资源的形式变了,但抢资源的本质从未改变",
      "isbn": "9787532720194",
      "isbn10": null,
      "isbn13": "9787532720194",
      "cover_url": "/covers/book-009.jpg",
      "cover_thumbnail_url": "/covers/book-009-thumb.jpg",
      "enrichment": {
        "source": "douban",
        "matched_title": "石油风云",
        "confidence": 0.98
      },
      "author": "丹尼尔·耶金"
    },
    {
      "id": "book-010",
      "title": "理性的疯狂梦",
      "recommender": "火山石投资 Jenny",
      "recommendation": "我们正生活在冯·诺依曼所奠基的“理性帝国”中——从原子弹到计算机,再到戴密斯·哈萨比斯缔造的AlphaGo战胜李世石,理性工具不断突破边界,工具越强大,我们却越感到迷茫:当科学无法提供确定性,人该如何自处?书中揭示的“哥德尔不完备定理”暗示了任何理性系统都存在无法自证的真理。或许,未来AI无论多么强大,都无法完全取代人类直觉、伦理判断和充满艺术性的创造力——就像李世石凭借“神之一手”,在绝对理性的算法中开辟了非理性的胜利。",
      "quote": "书中揭示的“哥德尔不完备定理”暗示了任何理性系统都存在无法自证的真理",
      "isbn": "9787020186112",
      "isbn10": null,
      "isbn13": "9787020186112",
      "cover_url": "/covers/book-010.jpg",
      "cover_thumbnail_url": "/covers/book-010-thumb.jpg",
      "enrichment": {
        "source": "douban",
        "matched_title": "理性的疯狂梦",
        "confidence": 0.99
      },
      "author": "本哈明·拉巴图特"
    }
  ],
  "stats": {
    "total": 10,
    "with_isbn": 10,
    "with_cover_url": 10
  }
}
